{
  "contractVersion": "0.1.0",
  "id": "eval_science_incorrect_001",
  "sessionId": "ses_demo_science_001",
  "problemId": "science.animals.sort-feathers",
  "workspaceSnapshotId": "snapshot_ses_demo_science_001_001",
  "evaluatorId": "science.classification-sort.pack.classification-sort",
  "isCorrect": false,
  "feedbackCode": "retry",
  "submittedAnswer": {
    "groups": [
      { "id": "feathers", "items": ["dog"] },
      { "id": "not_feathers", "items": [] }
    ]
  },
  "expectedAnswer": ["duck", "eagle"],
  "confidence": "high",
  "diagnostics": {
    "targetGroup": "feathers",
    "sortedItems": ["dog"],
    "missingItems": ["duck", "eagle"],
    "misplacedItems": ["dog"]
  },
  "evaluatedAt": "2026-05-28T00:00:00.000Z"
}
